Area,Recommended Strategy
Training Dataset,Use customer support conversations containing diverse accents and speaking styles.
Domain Adaptation,"Include industry-specific vocabulary, product names, and customer service terminology."
Audio Augmentation,"Apply background noise, telephone channel effects, and varying speaking rates during training."
Hyperparameter Tuning,"Experiment with learning rate, batch size, and training epochs using a validation dataset."
Model Evaluation,"Evaluate the fine-tuned model using Word Error Rate (WER), inference latency, and memory usage."
